{"$schema":"https://artemsemdev.github.io/SeaRise-Europe/contracts/release/v1/source-receipt.schema.json","acquiredAt":"2026-08-06T14:58:54Z","attributionId":"ipcc-ar6-sl-projections-20210809","byteSize":9243771601,"cache":{"key":"sha256/d3b1c2ed093cca491db2461e67b782bcca98763d326378ffee39908c2b094e91","publicationAllowed":false},"dataProvenanceClass":"synthetic-fixture","dataReleaseId":"searise-europe-v1.0.0-20260810-c096aeab4e09","receiptId":"source-ipcc-ar6-d3b1c2ed093c","schemaVersion":"1.0.0","sha256":"d3b1c2ed093cca491db2461e67b782bcca98763d326378ffee39908c2b094e91","sourceId":"ipcc-ar6-sea-level/20210809","sourceLock":{"path":"src/pipeline/sources/source-lock.json","sha256":"d1f819b7338f90abac0b76dda06cb6779d3231ebedcac54ef9ab78dc7f821066"},"sourceUrl":"https://zenodo.org/api/records/6382554/files/ar6-regional-confidence.zip/content","sourceVersion":"20210809","verification":{"algorithm":"sha256","status":"passed","verifiedBeforeUse":true}}
